{
  "schema_version": "1.0.0",
  "echo_id": "echo_00000004-email-empire-launch",
  "moment_type": "ritual",
  "title": "NOIZYEMPIRE Email Rebuild — The 8-Step Ritual",
  "subtitle": "rsp@noizy.ai — the GoDaddy chain breaks forever",
  "narrative": "The 8-step ritual to rebuild the entire NOIZYEMPIRE email starting with rsp@noizy.ai: 1) Open Safari on iPad. 2) Go to dash.cloudflare.com. 3) noizy.ai → Email → Email Routing → Enable. 4) Create: rsp → rsplowman@icloud.com. 5) Enable Catch-all. 6) Check iCloud mail — verify the CF email. 7) github.com/signup with rsp@noizy.ai. 8) Passkey on immediately. Then step 9: Cloudflare My Profile → change login email from rsp@noizyfish.com to rsp@noizy.ai. The moment the GoDaddy circular dependency breaks forever. rsp@noizy.ai becomes the primary identity. The email empire rebuilds from here.",
  "created_at": "2026-03-28T05:00:00Z",
  "creator": { "actor_id": "RSP_001", "display_name": "Rob Plowman", "brand_home": "NOIZY" },
  "sovereignty": {
    "consent_required": true,
    "provenance_required": true,
    "receipt_required": true,
    "never_clause_classes": ["nsfw", "political_persuasion", "medical_advice", "sublicense"]
  },
  "sensory": {
    "tags": ["email-empire", "rsp@noizy.ai", "cloudflare", "icloud", "godaddy-escape", "passkey", "github", "iPad", "ritual", "identity-migration"],
    "mood": ["decisive", "resolute", "liberated"],
    "culture_context": "The moment Robert breaks free from the GoDaddy circular dependency. rsp@noizyfish.com was the chain. rsp@noizy.ai is the key. Eight steps on an iPad and the empire rebuilds on sovereign ground."
  },
  "accessibility": { "deaf_hh_ready": true, "low_sensory_ready": true },
  "links": {
    "artifact_ids": [],
    "manifest_ids": [],
    "receipt_ids": [],
    "memcell_ids": ["mem_004"],
    "origin_engine": {
      "prompt_id": "dream_chamber_session_001",
      "questions": ["WE WILL REBUILD THE ENTIRE EMAIL NOIZYEMPIRE STARTING WITH rsp@noizy.ai"],
      "answers_ref": "echo_00000003-dream-chamber-gorunfree"
    }
  },
  "lineage": {
    "parent_echo_id": "echo_00000003-dream-chamber-gorunfree",
    "lineage_hash": "sha256:email_empire_launch_v1"
  }
}
